{
  "$schema": "http://json-schema.org/draft-07/schema#",
  "$id": "https://ai-web-tester/ir/schema.json",
  "title": "AI Web Tester IR",
  "description": "语言无关的测试用例中间表示(IR)。单一事实源,由此生成 Python(pytest)与 TypeScript(@playwright/test)两种 Playwright 脚本。",
  "type": "object",
  "required": ["name", "steps"],
  "additionalProperties": false,
  "properties": {
    "name": {"type": "string", "description": "用例名称(会成为测试函数/用例标题)"},
    "feature": {"type": "string", "description": "所属功能模块,用于覆盖统计分组"},
    "baseURL": {"type": "string", "description": "基础 URL;step.url 以 / 开头时自动拼接"},
    "tags": {"type": "array", "items": {"type": "string"}},
    "architecture": {
      "type": "object",
      "description": "架构适配配置（可选）",
      "properties": {
        "mode": {"type": "string", "enum": ["linear", "pom"], "description": "架构模式：linear=线性脚本，pom=Page Object 模式"},
        "language": {"type": "string", "enum": ["py", "ts"], "description": "目标语言（用于 auto 模式推断）"},
        "base_class": {"type": "string", "description": "POM 模式的基类名称"},
        "page_pattern": {"type": "string", "description": "Page Object 命名模式，如 {name}Page"},
        "import_style": {"type": "string", "enum": ["absolute", "relative"], "description": "导入风格"},
        "pages_path": {"type": "string", "description": "Page Object 文件路径"},
        "page_class": {"type": "string", "description": "当前测试使用的页面类名（大模型根据参考项目分析确定）"},
        "method_mappings": {
          "type": "object",
          "description": "方法映射（大模型根据参考项目分析确定）",
          "properties": {
            "goto": {"type": "string", "description": "导航方法名，如 navigate"},
            "fill": {"type": "object", "description": "填充方法映射，按 locator value 映射到方法名"},
            "click": {"type": "object", "description": "点击方法映射，按 locator value 映射到方法名"}
          }
        }
      }
    },
    "steps": {
      "type": "array",
      "minItems": 1,
      "items": {"$ref": "#/definitions/step"}
    }
  },
  "definitions": {
    "locator": {
      "type": "object",
      "required": ["by"],
      "additionalProperties": false,
      "properties": {
        "by": {
          "type": "string",
          "enum": ["role", "label", "text", "placeholder", "testid", "alt", "title", "css", "xpath"]
        },
        "value": {"type": "string", "description": "label/text/placeholder/testid/alt/title/css/xpath 的值"},
        "role": {"type": "string", "description": "by=role 时的 ARIA role,如 button/link/textbox"},
        "name": {"type": "string", "description": "by=role 时的可访问名称"},
        "exact": {"type": "boolean", "description": "是否精确匹配(role/label/text)"},
        "nth": {"type": "integer", "description": "命中多个时取第 n 个(0 基)"}
      }
    },
    "step": {
      "type": "object",
      "required": ["action"],
      "properties": {
        "action": {
          "type": "string",
          "enum": ["goto", "click", "dblclick", "fill", "type", "press", "select",
                   "check", "uncheck", "hover", "wait", "expect", "upload", "drag", "scroll"]
        },
        "url": {"type": "string", "description": "goto 的目标(相对或绝对)"},
        "locator": {"$ref": "#/definitions/locator"},
        "value": {"type": "string", "description": "fill/type/select 的值;支持 <secret:ENV_NAME> 占位读取环境变量"},
        "key": {"type": "string", "description": "press 的按键,如 Enter / Escape"},
        "ms": {"type": "integer", "description": "wait 的毫秒数"},
        "comment": {"type": "string"},
        "type": {
          "type": "string",
          "description": "action=expect 时的断言类型",
          "enum": ["url_contains", "url_eq", "title_contains", "text_visible",
                   "element_visible", "element_hidden", "value_eq", "count_eq", "attr_eq",
                   "contains_text", "attr_exists", "enabled", "disabled"]
        },
        "attr": {"type": "string", "description": "attr_eq 的属性名"},
        "count": {"type": "integer", "description": "count_eq 的期望数量"},
        "target": {"type": "object", "description": "drag 动作的目标元素 locator", "$ref": "#/definitions/locator"}
      },
      "allOf": [
        {"if": {"properties": {"action": {"const": "goto"}}}, "then": {"required": ["url"]}},
        {"if": {"properties": {"action": {"const": "expect"}}}, "then": {"required": ["type"]}},
        {"if": {"properties": {"action": {"enum": ["click", "dblclick", "hover", "check", "uncheck"]}}},
         "then": {"required": ["locator"]}},
        {"if": {"properties": {"action": {"enum": ["fill", "type", "select"]}}},
         "then": {"required": ["locator", "value"]}},
        {"if": {"properties": {"action": {"const": "upload"}}}, "then": {"required": ["locator", "value"]}},
        {"if": {"properties": {"action": {"const": "drag"}}}, "then": {"required": ["locator", "target"]}},
        {"if": {"properties": {"action": {"const": "scroll"}}}, "then": {"required": ["locator"]}}
      ]
    }
  }
}
